{
  "$schema": "./references/audit-config-schema.json",
  "version": "1.0.0",
  "profilePath": "",
  "sitemapMax": 25,
  "thresholds": {
    "titleMin": 30,
    "titleMax": 60,
    "descriptionMin": 70,
    "descriptionMax": 160,
    "lcpGoodMs": 2500,
    "inpGoodMs": 200,
    "clsGood": 0.1,
    "targetPassScore": 90
  }
}
